{"contract":"DEVAM_CROSS_LANE_LINK_PROPOSALS_V1","proposal_pack_id":"sheetala-regional-observance-batch-3-owner-proposals-v1","lane_id":"ritual-calendar","anchor_registry_version":1,"status":"proposed_for_integration","proposals":[{"proposal_id":"basoda-to-sheetala-practice-owner","from_ref":{"lane_local_id":"ritual-calendar/basoda-north-india-sheetala-household-2027-v1"},"to_ref":{"lane_local_id":"practice/basoda-current-regional-owner"},"relationship_family":"practice","predicate":"requires_current_practice_owner_for","directionality":"directed","consumer_label":{"en":"Basoda: formal puja, mantra, temple, menu and regional practice remains with the current named family or institution owner.","hi":"बासोड़ा: औपचारिक पूजा, मंत्र, मंदिर, भोजन और क्षेत्रीय विधि वर्तमान नामित परिवार या संस्था-स्वामी के पास है।"},"scope":{"statement":"Basoda: formal puja, mantra, temple, menu and regional practice remains with the current named family or institution owner.","geography_codes":["north-india","IN-RJ","IN-UP"],"tradition_codes":["north-indian-basoda-family"],"time_scope":"post-Holi Chaitra Krishna Ashtami, with a first-Monday-or-Friday family variant","source_expression_scope":"Current owner verification required"},"evidence_refs":[{"evidence_kind":"devam_synthesis","ref":"devam-sheetala-batch-3","claim_scope":"Basoda: formal puja, mantra, temple, menu and regional practice remains with the current named family or institution owner."}],"confidence":"high","target_resolution":"unresolved_owner_lane","integration_status":"proposed"},{"proposal_id":"sheetala-ashtami-to-sheetala-practice-owner","from_ref":{"lane_local_id":"ritual-calendar/sheetala-ashtami-north-india-deity-household-2027-v1"},"to_ref":{"lane_local_id":"practice/sheetala-ashtami-current-regional-owner"},"relationship_family":"practice","predicate":"requires_current_practice_owner_for","directionality":"directed","consumer_label":{"en":"Sheetala Ashtami: formal puja, mantra, temple, menu and regional practice remains with the current named family or institution owner.","hi":"शीतला अष्टमी: औपचारिक पूजा, मंत्र, मंदिर, भोजन और क्षेत्रीय विधि वर्तमान नामित परिवार या संस्था-स्वामी के पास है।"},"scope":{"statement":"Sheetala Ashtami: formal puja, mantra, temple, menu and regional practice remains with the current named family or institution owner.","geography_codes":["north-india","IN-RJ","IN-UP"],"tradition_codes":["north-indian-sheetala-deity-observance"],"time_scope":"post-Holi Chaitra Krishna Ashtami, with named local Saptami/weekday variants","source_expression_scope":"Current owner verification required"},"evidence_refs":[{"evidence_kind":"devam_synthesis","ref":"devam-sheetala-batch-3","claim_scope":"Sheetala Ashtami: formal puja, mantra, temple, menu and regional practice remains with the current named family or institution owner."}],"confidence":"high","target_resolution":"unresolved_owner_lane","integration_status":"proposed"},{"proposal_id":"shitala-satam-to-sheetala-practice-owner","from_ref":{"lane_local_id":"ritual-calendar/shitala-satam-gujarat-household-participant-2027-v1"},"to_ref":{"lane_local_id":"practice/shitala-satam-current-regional-owner"},"relationship_family":"practice","predicate":"requires_current_practice_owner_for","directionality":"directed","consumer_label":{"en":"Shitala Satam: formal puja, mantra, temple, menu and regional practice remains with the current named family or institution owner.","hi":"शीतला सातम: औपचारिक पूजा, मंत्र, मंदिर, भोजन और क्षेत्रीय विधि वर्तमान नामित परिवार या संस्था-स्वामी के पास है।"},"scope":{"statement":"Shitala Satam: formal puja, mantra, temple, menu and regional practice remains with the current named family or institution owner.","geography_codes":["IN-GJ"],"tradition_codes":["gujarati-shitala-satam-family"],"time_scope":"Gujarati Shravana Krishna Saptami after Randhan Chhath","source_expression_scope":"Current owner verification required"},"evidence_refs":[{"evidence_kind":"devam_synthesis","ref":"devam-sheetala-batch-3","claim_scope":"Shitala Satam: formal puja, mantra, temple, menu and regional practice remains with the current named family or institution owner."}],"confidence":"high","target_resolution":"unresolved_owner_lane","integration_status":"proposed"}]}
