{"contract":"DEVAM_CROSS_LANE_LINK_PROPOSALS_V1","proposal_pack_id":"trayodashi-shraddha-child-gujarat-overlap-and-formal-owner-proposals-v1","lane_id":"ritual-calendar","anchor_registry_version":1,"status":"proposed_for_integration","proposals":[{"proposal_id":"trayodashi-to-existing-remembrance","from_ref":{"lane_local_id":"ritual-calendar/trayodashi-shraddha-north-west-authority-router-2027-v1"},"to_ref":{"lane_local_id":"ritual/pitru-paksha-delhi-remembrance-content-v1"},"relationship_family":"practice","predicate":"reuses_private_remembrance_boundary_from","directionality":"directed","consumer_label":{"en":"Reuse safe private remembrance","hi":"Safe private remembrance reuse"},"scope":{"statement":"Partial privacy/no-result reuse; not formal owner.","geography_codes":["IN"],"tradition_codes":["trayodashi-shraddha"],"time_scope":"Locally resolved Trayodashi-aparahna and named authority","source_expression_scope":null},"evidence_refs":[{"evidence_kind":"ritual_lane","ref":"ritual/pitru-paksha-delhi-remembrance-content-v1","claim_scope":"Private remembrance boundary."}],"confidence":"high","target_resolution":"lane_local","integration_status":"proposed"},{"proposal_id":"trayodashi-to-magha","from_ref":{"lane_local_id":"ritual-calendar/trayodashi-shraddha-north-west-authority-router-2027-v1"},"to_ref":{"lane_local_id":"ritual-calendar/magha-shraddha-north-west-authority-router-2027-v1"},"relationship_family":"time","predicate":"requires_distinct_overlap_resolution_with","directionality":"bidirectional","consumer_label":{"en":"Magha overlap needs separate resolution","hi":"Magha overlap अलग resolve हो"},"scope":{"statement":"Tithi and Nakshatra rules remain distinct.","geography_codes":["IN"],"tradition_codes":["trayodashi-shraddha"],"time_scope":"Locally resolved Trayodashi-aparahna and named authority","source_expression_scope":null},"evidence_refs":[{"evidence_kind":"ritual_lane","ref":"ritual-calendar/magha-shraddha-north-west-authority-router-2027-v1","claim_scope":"Reviewed Magha rule."}],"confidence":"high","target_resolution":"lane_local","integration_status":"proposed"},{"proposal_id":"trayodashi-to-formal-owner","from_ref":{"lane_local_id":"ritual-calendar/trayodashi-shraddha-north-west-authority-router-2027-v1"},"to_ref":{"lane_local_id":"ritual-calendar/named-trayodashi-shraddha-authority"},"relationship_family":"practice","predicate":"requires_named_formal_authority_for","directionality":"directed","consumer_label":{"en":"Formal Trayodashi needs a named owner","hi":"Formal Trayodashi को named owner चाहिए"},"scope":{"statement":"Applicability, performer, timing, materials and close remain owner work.","geography_codes":["IN"],"tradition_codes":["trayodashi-shraddha"],"time_scope":"Locally resolved Trayodashi-aparahna and named authority","source_expression_scope":null},"evidence_refs":[{"evidence_kind":"devam_synthesis","ref":"devam-trayodashi-research","claim_scope":"Formal authority boundary."}],"confidence":"high","target_resolution":"unresolved_owner_lane","integration_status":"proposed"},{"proposal_id":"trayodashi-to-child-loss-owner","from_ref":{"lane_local_id":"ritual-calendar/trayodashi-shraddha-north-west-authority-router-2027-v1"},"to_ref":{"lane_local_id":"ritual-calendar/named-child-loss-trayodashi-authority"},"relationship_family":"practice","predicate":"requires_bereavement_safe_authority_for","directionality":"directed","consumer_label":{"en":"Child-loss route needs bereavement-safe authority","hi":"Child-loss route को bereavement-safe authority चाहिए"},"scope":{"statement":"No calendar may classify, blame or generate a child rite.","geography_codes":["IN"],"tradition_codes":["trayodashi-shraddha"],"time_scope":"Locally resolved Trayodashi-aparahna and named authority","source_expression_scope":null},"evidence_refs":[{"evidence_kind":"living_practice","ref":"drik-trayodashi-ajmer-2027","claim_scope":"Attributed child applicability."}],"confidence":"high","target_resolution":"unresolved_owner_lane","integration_status":"proposed"},{"proposal_id":"trayodashi-to-gujarat-owner","from_ref":{"lane_local_id":"ritual-calendar/trayodashi-shraddha-north-west-authority-router-2027-v1"},"to_ref":{"lane_local_id":"ritual-calendar/gujarat-kakbali-balabholani-teras-authority"},"relationship_family":"practice","predicate":"requires_current_regional_owner_for","directionality":"directed","consumer_label":{"en":"Gujarat Kakbali/Balabholani needs a current owner","hi":"Gujarat Kakbali/Balabholani को current owner चाहिए"},"scope":{"statement":"Regional name does not establish ordered practice.","geography_codes":["IN"],"tradition_codes":["trayodashi-shraddha"],"time_scope":"Locally resolved Trayodashi-aparahna and named authority","source_expression_scope":null},"evidence_refs":[{"evidence_kind":"living_practice","ref":"drik-trayodashi-ajmer-2027","claim_scope":"Gujarat names."}],"confidence":"high","target_resolution":"unresolved_owner_lane","integration_status":"proposed"},{"proposal_id":"trayodashi-to-nachiketa-story","from_ref":{"lane_local_id":"ritual-calendar/trayodashi-shraddha-north-west-authority-router-2027-v1"},"to_ref":{"lane_local_id":"story/katha-upanishad-nachiketa-yama-source-context"},"relationship_family":"story","predicate":"uses_death_discernment_story_context","directionality":"directed","consumer_label":{"en":"Nachiketa asks Yama about death","hi":"Nachiketa Yama से death पूछते हैं"},"scope":{"statement":"Reflection only; not child-loss explanation or vidhi.","geography_codes":["IN"],"tradition_codes":["trayodashi-shraddha"],"time_scope":null,"source_expression_scope":null},"evidence_refs":[{"evidence_kind":"source_passage","ref":"max-muller-katha-upanishad:first-and-second-valli","claim_scope":"Complete bounded story."}],"confidence":"high","target_resolution":"unresolved_owner_lane","integration_status":"proposed"},{"proposal_id":"trayodashi-to-place-owner","from_ref":{"lane_local_id":"ritual-calendar/trayodashi-shraddha-north-west-authority-router-2027-v1"},"to_ref":{"lane_local_id":"institution/named-gaya-ghat-trayodashi-authority"},"relationship_family":"place","predicate":"requires_current_place_authority_for","directionality":"directed","consumer_label":{"en":"Named place participation needs a current owner","hi":"Named place को current owner चाहिए"},"scope":{"statement":"Access, water, animals, payment and close cannot be inferred.","geography_codes":["IN"],"tradition_codes":["trayodashi-shraddha"],"time_scope":null,"source_expression_scope":null},"evidence_refs":[{"evidence_kind":"devam_synthesis","ref":"devam-trayodashi-research","claim_scope":"Place safety boundary."}],"confidence":"high","target_resolution":"unresolved_owner_lane","integration_status":"proposed"}]}
