{"contract":"DEVAM_CROSS_LANE_LINK_PROPOSALS_V1","proposal_pack_id":"monthly-vinayaka-named-chaturthi-batch-4-owner-proposals-v1","lane_id":"ritual-calendar","anchor_registry_version":1,"status":"proposed_for_integration","proposals":[{"proposal_id":"vasudeva-chaturthi-to-ganesha-owner","from_ref":{"lane_local_id":"ritual-calendar/vasudeva-chaturthi-monthly-vinayaka-household-participant-2027-v1"},"to_ref":{"lane_local_id":"ganesha-consumer/vasudeva-chaturthi-formal-owner"},"relationship_family":"practice","predicate":"requires_named_ganesha_practice_owner_for","directionality":"directed","consumer_label":{"en":"Vasudeva Chaturthi: formal Ganesha identity, mantra, vrata and source-recension ownership remains with the Ganesha consumer and named practitioner lanes.","hi":"वासुदेव चतुर्थी: औपचारिक गणेश पहचान, मंत्र, व्रत और स्रोत-पाठ नामित स्वामी के पास रहता है।"},"scope":{"statement":"Vasudeva Chaturthi: formal Ganesha identity, mantra, vrata and source-recension ownership remains with the Ganesha consumer and named practitioner lanes.","geography_codes":["IN"],"tradition_codes":["monthly-vinayaka-named-chaturthi"],"time_scope":"Locally resolved Chaitra Shukla Chaturthi","source_expression_scope":"Current named katha expression requires owner/source review"},"evidence_refs":[{"evidence_kind":"devam_synthesis","ref":"devam-monthly-vinayaka-batch-4","claim_scope":"Vasudeva Chaturthi: formal Ganesha identity, mantra, vrata and source-recension ownership remains with the Ganesha consumer and named practitioner lanes."}],"confidence":"high","target_resolution":"unresolved_owner_lane","integration_status":"proposed"},{"proposal_id":"sankarshana-chaturthi-to-ganesha-owner","from_ref":{"lane_local_id":"ritual-calendar/sankarshana-chaturthi-monthly-vinayaka-household-participant-2027-v1"},"to_ref":{"lane_local_id":"ganesha-consumer/sankarshana-chaturthi-formal-owner"},"relationship_family":"practice","predicate":"requires_named_ganesha_practice_owner_for","directionality":"directed","consumer_label":{"en":"Sankarshana Chaturthi: formal Ganesha identity, mantra, vrata and source-recension ownership remains with the Ganesha consumer and named practitioner lanes.","hi":"संकर्षण चतुर्थी: औपचारिक गणेश पहचान, मंत्र, व्रत और स्रोत-पाठ नामित स्वामी के पास रहता है।"},"scope":{"statement":"Sankarshana Chaturthi: formal Ganesha identity, mantra, vrata and source-recension ownership remains with the Ganesha consumer and named practitioner lanes.","geography_codes":["IN"],"tradition_codes":["monthly-vinayaka-named-chaturthi"],"time_scope":"Locally resolved Vaishakha Shukla Chaturthi","source_expression_scope":"Current named katha expression requires owner/source review"},"evidence_refs":[{"evidence_kind":"devam_synthesis","ref":"devam-monthly-vinayaka-batch-4","claim_scope":"Sankarshana Chaturthi: formal Ganesha identity, mantra, vrata and source-recension ownership remains with the Ganesha consumer and named practitioner lanes."}],"confidence":"high","target_resolution":"unresolved_owner_lane","integration_status":"proposed"},{"proposal_id":"pradyumna-chaturthi-to-ganesha-owner","from_ref":{"lane_local_id":"ritual-calendar/pradyumna-chaturthi-monthly-vinayaka-household-participant-2027-v1"},"to_ref":{"lane_local_id":"ganesha-consumer/pradyumna-chaturthi-formal-owner"},"relationship_family":"practice","predicate":"requires_named_ganesha_practice_owner_for","directionality":"directed","consumer_label":{"en":"Pradyumna Chaturthi: formal Ganesha identity, mantra, vrata and source-recension ownership remains with the Ganesha consumer and named practitioner lanes.","hi":"प्रद्युम्न चतुर्थी: औपचारिक गणेश पहचान, मंत्र, व्रत और स्रोत-पाठ नामित स्वामी के पास रहता है।"},"scope":{"statement":"Pradyumna Chaturthi: formal Ganesha identity, mantra, vrata and source-recension ownership remains with the Ganesha consumer and named practitioner lanes.","geography_codes":["IN"],"tradition_codes":["monthly-vinayaka-named-chaturthi"],"time_scope":"Locally resolved Jyeshtha Shukla Chaturthi","source_expression_scope":"Current named katha expression requires owner/source review"},"evidence_refs":[{"evidence_kind":"devam_synthesis","ref":"devam-monthly-vinayaka-batch-4","claim_scope":"Pradyumna Chaturthi: formal Ganesha identity, mantra, vrata and source-recension ownership remains with the Ganesha consumer and named practitioner lanes."}],"confidence":"high","target_resolution":"unresolved_owner_lane","integration_status":"proposed"},{"proposal_id":"aniruddha-chaturthi-to-ganesha-owner","from_ref":{"lane_local_id":"ritual-calendar/aniruddha-chaturthi-monthly-vinayaka-household-participant-2027-v1"},"to_ref":{"lane_local_id":"ganesha-consumer/aniruddha-chaturthi-formal-owner"},"relationship_family":"practice","predicate":"requires_named_ganesha_practice_owner_for","directionality":"directed","consumer_label":{"en":"Aniruddha Chaturthi: formal Ganesha identity, mantra, vrata and source-recension ownership remains with the Ganesha consumer and named practitioner lanes.","hi":"अनिरुद्ध चतुर्थी: औपचारिक गणेश पहचान, मंत्र, व्रत और स्रोत-पाठ नामित स्वामी के पास रहता है।"},"scope":{"statement":"Aniruddha Chaturthi: formal Ganesha identity, mantra, vrata and source-recension ownership remains with the Ganesha consumer and named practitioner lanes.","geography_codes":["IN"],"tradition_codes":["monthly-vinayaka-named-chaturthi"],"time_scope":"Locally resolved Ashadha Shukla Chaturthi","source_expression_scope":"Current named katha expression requires owner/source review"},"evidence_refs":[{"evidence_kind":"devam_synthesis","ref":"devam-monthly-vinayaka-batch-4","claim_scope":"Aniruddha Chaturthi: formal Ganesha identity, mantra, vrata and source-recension ownership remains with the Ganesha consumer and named practitioner lanes."}],"confidence":"high","target_resolution":"unresolved_owner_lane","integration_status":"proposed"}]}
