{
  "contract": "DEVAM_CROSS_LANE_LINK_PROPOSALS_V1",
  "proposal_pack_id": "ritual-calendar-jaya-padma-purana-story-owner-proposal-v1",
  "lane_id": "ritual-calendar",
  "anchor_registry_version": 1,
  "status": "proposed_for_integration",
  "proposals": [
    {
      "proposal_id": "jaya-to-padma-purana-malyavat-pushpavati-story-owner",
      "from_ref": {"lane_local_id": "ritual-calendar/jaya-ekadashi-north-west-smarta-household-2027-v1"},
      "to_ref": {"lane_local_id": "story/padma-purana-jaya-malyavat-pushpavati-source-context"},
      "relationship_family": "story",
      "predicate": "requests_full_source_labelled_jaya_malyavat_pushpavati_context",
      "directionality": "directed",
      "consumer_label": {"en": "Read the full source-labelled Jaya account", "hi": "जया की पूरी स्रोत-नाम वाली कथा पढ़ें"},
      "scope": {
        "statement": "The ritual pack uses a bounded retelling from the reviewed Deshpande English expression of Padma Purana, Uttara Khanda chapter 43. A future story/scripture owner should provide the lawful full expression, Sanskrit and edition coordinates, and reception context while preserving the objectifying description, mutual attraction, performance lapse, Indra's curse and unequal power, supernatural forms, cold, deprivation, clinging, sleeplessness and attributed restoration as source facts rather than Devam morals, diagnoses, ritual instructions or guarantees.",
        "geography_codes": ["north-india", "west-india"],
        "tradition_codes": ["smarta-north-india", "smarta-west-india"],
        "time_scope": "Locally resolved Magha Shukla Ekadashi; reviewed 2027 fixture 17 February",
        "source_expression_scope": "N. A. Deshpande English translation, Padma Purana Uttara Khanda chapter 43; Sanskrit, edition and reception owner review unresolved"
      },
      "evidence_refs": [
        {"evidence_kind": "source_passage", "ref": "https://www.wisdomlib.org/hinduism/book/the-padma-purana/d/doc365620.html", "claim_scope": "Reviewed chapter 43 expression narrating Malyavat and Pushpadanti/Pushpavati, Indra's curse, their Himalayan suffering and attributed restoration."},
        {"evidence_kind": "ritual_lane", "ref": "knowledge_packs/library_lanes/ritual-calendar/packs/jaya-ekadashi-north-west-smarta-household-2027-v1.json", "claim_scope": "Bilingual timing, bounded source-labelled story, warm and rested non-fasting household action, consent and crisis safety, closing, and major-variant routing."}
      ],
      "confidence": "medium",
      "target_resolution": "unresolved_owner_lane",
      "integration_status": "proposed"
    }
  ]
}
