{"contract":"DEVAM_CROSS_LANE_LINK_PROPOSALS_V1","proposal_pack_id":"cattle-honour-observance-batch-3-owner-proposals-v1","lane_id":"ritual-calendar","anchor_registry_version":1,"status":"proposed_for_integration","proposals":[{"proposal_id":"bol-choth-to-cattle-practice-owner","from_ref":{"lane_local_id":"ritual-calendar/bol-choth-gujarat-cattle-safe-household-2027-v1"},"to_ref":{"lane_local_id":"practice/bol-choth-current-regional-owner"},"relationship_family":"practice","predicate":"requires_current_practice_owner_for","directionality":"directed","consumer_label":{"en":"Bol Choth: formal animal care, temple, procession, fast and regional practice remains with current named owners.","hi":"बोल चौथ: औपचारिक पशु-देखभाल, मंदिर, जुलूस, उपवास और क्षेत्रीय विधि वर्तमान नामित स्वामियों के पास है।"},"scope":{"statement":"Bol Choth: formal animal care, temple, procession, fast and regional practice remains with current named owners.","geography_codes":["IN-GJ"],"tradition_codes":["gujarati-bol-choth"],"time_scope":"Gujarati Shravana Krishna Chaturthi before Nag Pancham","source_expression_scope":"Current owner verification required"},"evidence_refs":[{"evidence_kind":"devam_synthesis","ref":"devam-cattle-batch-3","claim_scope":"Bol Choth: formal animal care, temple, procession, fast and regional practice remains with current named owners."}],"confidence":"high","target_resolution":"unresolved_owner_lane","integration_status":"proposed"},{"proposal_id":"pola-to-cattle-practice-owner","from_ref":{"lane_local_id":"ritual-calendar/pola-maharashtra-chhattisgarh-cattle-safe-participant-2027-v1"},"to_ref":{"lane_local_id":"practice/pola-current-regional-owner"},"relationship_family":"practice","predicate":"requires_current_practice_owner_for","directionality":"directed","consumer_label":{"en":"Pola (Bail Pola): formal animal care, temple, procession, fast and regional practice remains with current named owners.","hi":"पोला (बैल पोला): औपचारिक पशु-देखभाल, मंदिर, जुलूस, उपवास और क्षेत्रीय विधि वर्तमान नामित स्वामियों के पास है।"},"scope":{"statement":"Pola (Bail Pola): formal animal care, temple, procession, fast and regional practice remains with current named owners.","geography_codes":["IN-MH","IN-CG"],"tradition_codes":["maharashtra-chhattisgarh-pola"],"time_scope":"Amanta Shravana Amavasya / locally resolved Pola Amavasya","source_expression_scope":"Current owner verification required"},"evidence_refs":[{"evidence_kind":"devam_synthesis","ref":"devam-cattle-batch-3","claim_scope":"Pola (Bail Pola): formal animal care, temple, procession, fast and regional practice remains with current named owners."}],"confidence":"high","target_resolution":"unresolved_owner_lane","integration_status":"proposed"},{"proposal_id":"vrishabhotsava-to-cattle-practice-owner","from_ref":{"lane_local_id":"ritual-calendar/vrishabhotsava-bull-nandi-owner-routed-household-2027-v1"},"to_ref":{"lane_local_id":"practice/vrishabhotsava-current-regional-owner"},"relationship_family":"practice","predicate":"requires_current_practice_owner_for","directionality":"directed","consumer_label":{"en":"Vrishabhotsava: formal animal care, temple, procession, fast and regional practice remains with current named owners.","hi":"वृषभोत्सव: औपचारिक पशु-देखभाल, मंदिर, जुलूस, उपवास और क्षेत्रीय विधि वर्तमान नामित स्वामियों के पास है।"},"scope":{"statement":"Vrishabhotsava: formal animal care, temple, procession, fast and regional practice remains with current named owners.","geography_codes":["west-india","south-india"],"tradition_codes":["bull-nandi-owner-routed"],"time_scope":"current calendars co-list with Pola on locally resolved Shravana/Bhadrapada Amavasya; named Shaiva owner may differ","source_expression_scope":"Current owner verification required"},"evidence_refs":[{"evidence_kind":"devam_synthesis","ref":"devam-cattle-batch-3","claim_scope":"Vrishabhotsava: formal animal care, temple, procession, fast and regional practice remains with current named owners."}],"confidence":"high","target_resolution":"unresolved_owner_lane","integration_status":"proposed"}]}
